{
  "id": "node-card:entity-equipment-graduated-cylinder",
  "node_id": "entity/equipment:graduated-cylinder",
  "card_layer": "support",
  "title": "量筒",
  "pattern_refs": ["pattern:entity-profile-v2"],
  "summary": "量筒是实验室用于量取一定体积液体的量器，有不同规格，读数时视线应与凹液面最低处保持水平。",
  "sections": [
    {
      "id": "identity",
      "title": "基本身份",
      "section_type": "definition",
      "content": [
        "量筒是一种用于量取一定体积液体的玻璃仪器。",
        "量筒有不同规格，如10mL、50mL、100mL等，应根据需要选择合适规格的量筒。",
        "量筒不可受热，不能用于化学反应，也不能量取热的液体。"
      ],
      "source_refs": ["evidence:chem-grade8-all-in-one:lesson:1-2-1:graduated-cylinder"]
    },
    {
      "id": "properties",
      "title": "关键属性",
      "section_type": "structure",
      "content": [
        "材质：玻璃",
        "规格：有多种规格（如10mL、50mL、100mL等）",
        "特点：不可受热、刻度均匀",
        "读数规则：量筒放平，视线与凹液面最低处保持水平"
      ],
      "source_refs": ["evidence:chem-grade8-all-in-one:lesson:1-2-1:graduated-cylinder"]
    },
    {
      "id": "functions",
      "title": "功能与用途",
      "section_type": "application",
      "content": [
        "量取一定体积的液体",
        "配合胶头滴管进行精确量取"
      ],
      "source_refs": ["evidence:chem-grade8-all-in-one:lesson:1-2-1:graduated-cylinder"]
    },
    {
      "id": "tests",
      "title": "注意事项",
      "section_type": "procedure",
      "content": [
        "量筒不可受热",
        "不能在量筒内进行化学反应",
        "不宜用量筒量取热的液体",
        "读数时视线应与凹液面最低处保持水平"
      ],
      "source_refs": ["evidence:chem-grade8-all-in-one:lesson:1-2-1:graduated-cylinder"]
    }
  ],
  "profile_refs": ["profile:entity-equipment-graduated-cylinder-junior-chem"],
  "source_refs": ["evidence:chem-grade8-all-in-one:lesson:1-2-1:graduated-cylinder"],
  "properties": {},
  "status": "reviewed",
  "updated_at": "2026-03-25T12:00:00+08:00"
}
