{
  "id": "node-card:concept__oxide",
  "node_id": "concept:oxide",
  "card_layer": "backbone",
  "title": "氧化物",
  "pattern_refs": ["pattern:concept-core-v2"],
  "summary": "氧化物是仅由两种元素组成且其中一种是氧元素的化合物，是化合物的一个重要子类。",
  "sections": [
    {
      "id": "definition",
      "title": "定义",
      "section_type": "definition",
      "content": [
        "氧化物是仅由两种元素组成且其中一种是氧元素的化合物。",
        "例如：水(H₂O)、二氧化锰(MnO₂)、二氧化碳(CO₂)等都是氧化物。",
        "氧化物是化合物的一种，必须同时满足：(1)只含两种元素；(2)其中一种是氧元素。"
      ],
      "source_refs": ["evidence:chem-grade8-all-in-one:lesson:3-2-2:simple-substance-compound"]
    },
    {
      "id": "essence",
      "title": "本质理解",
      "section_type": "essence",
      "content": [
        "氧化物是化合物的一个子类，具有化合物的所有特征。",
        "氧化物的特点：(1)一定是化合物；(2)只含两种元素；(3)一定含氧元素。",
        "氧化物与含氧化合物的区别：含氧化合物不一定只有两种元素，如高锰酸钾(KMnO₄)含四种元素，不是氧化物。"
      ],
      "source_refs": ["evidence:chem-grade8-all-in-one:lesson:3-2-2:simple-substance-compound"]
    },
    {
      "id": "key-points",
      "title": "核心要点",
      "section_type": "key_points",
      "content": [
        "判断氧化物的三个条件：(1)是纯净物；(2)只含两种元素；(3)其中一种是氧元素。",
        "氧化物一定是化合物，但化合物不一定是氧化物。",
        "氧化物可以根据性质分为酸性氧化物和碱性氧化物。",
        "氧化物可以根据组成分为金属氧化物和非金属氧化物。"
      ],
      "source_refs": ["evidence:chem-grade8-all-in-one:lesson:3-2-2:simple-substance-compound"]
    },
    {
      "id": "examples",
      "title": "典型例子",
      "section_type": "example",
      "content": [
        "水(H₂O)：由氢元素和氧元素组成的氧化物。",
        "二氧化锰(MnO₂)：由锰元素和氧元素组成的氧化物。",
        "二氧化碳(CO₂)：由碳元素和氧元素组成的氧化物。",
        "氧化镁(MgO)：由镁元素和氧元素组成的氧化物。",
        "氧化铁(Fe₂O₃)：由铁元素和氧元素组成的氧化物。"
      ],
      "source_refs": ["evidence:chem-grade8-all-in-one:lesson:3-2-2:simple-substance-compound"]
    },
    {
      "id": "misconceptions",
      "title": "易混辨析",
      "section_type": "misconception",
      "content": [
        "含氧化合物不一定是氧化物：高锰酸钾(KMnO₄)含氧元素但不是氧化物。",
        "氧化物必须只有两种元素：水(H₂O)是氧化物，但过氧化氢(H₂O₂)也是氧化物。",
        "氧气(O₂)不是氧化物：氧气是单质，不是化合物。"
      ]
    }
  ],
  "framework_refs": ["framework:cn-chem-junior:expectation:68980548de"],
  "profile_refs": ["profile:concept-oxide-junior-chem"],
  "source_refs": ["evidence:chem-grade8-all-in-one:lesson:3-2-2:simple-substance-compound"],
  "properties": {},
  "status": "reviewed",
  "updated_at": "2026-03-26T00:00:00+08:00"
}
