{
  "id": "node-card:method-gas-collection-water-displacement",
  "node_id": "method:gas-collection-water-displacement",
  "card_layer": "support",
  "title": "排水法",
  "pattern_refs": ["pattern:method-procedure-v2"],
  "summary": "排水法是收集难溶或微溶于水且不与水发生化学反应的气体的方法。收集的气体纯度高但含有一定量水分。适用于氧气、氢气等气体的收集。",
  "sections": [
    {
      "id": "goal",
      "title": "目标",
      "section_type": "definition",
      "content": [
        "收集难溶或微溶于水的气体。",
        "获得高纯度的气体样品。",
        "便于观察气体是否收集满。"
      ],
      "source_refs": ["evidence:chem-grade8-all-in-one:lesson:2-1-3:gas-collection-methods"]
    },
    {
      "id": "conditions",
      "title": "适用条件",
      "section_type": "assessment",
      "content": [
        "气体难溶或微溶于水。",
        "气体不与水发生化学反应。",
        "适用气体：氧气、氢气、氮气等。",
        "不适用气体：二氧化碳（溶于水且与水反应）、氨气（极易溶于水）、氯化氢（极易溶于水）。"
      ],
      "source_refs": ["evidence:chem-grade8-all-in-one:lesson:2-1-3:gas-collection-methods"]
    },
    {
      "id": "steps",
      "title": "操作步骤",
      "section_type": "procedure",
      "content": [
        "第一步：准备集气瓶——将集气瓶装满水，用玻璃片盖住瓶口，倒扣在水槽中。",
        "第二步：检查装置——确认装置气密性良好。",
        "第三步：收集气体——待气体均匀产生后，将导管伸入集气瓶口下方。",
        "第四步：观察气泡——气泡连续均匀冒出时开始收集。",
        "第五步：判断收集满——集气瓶口有大气泡向外冒出时，说明已收集满。",
        "第六步：取出集气瓶——在水下用玻璃片盖住瓶口，取出集气瓶。"
      ],
      "source_refs": ["evidence:chem-grade8-all-in-one:lesson:2-1-3:gas-collection-methods"]
    },
    {
      "id": "errors",
      "title": "优缺点分析",
      "section_type": "misconception",
      "content": [
        "优点：收集的气体纯度高；容易观察气体是否已收集满。",
        "缺点：收集的气体含有一定量的水蒸气；操作相对复杂；不适用于溶于水的气体。"
      ],
      "source_refs": ["evidence:chem-grade8-all-in-one:lesson:2-1-3:gas-collection-methods"]
    }
  ],
  "framework_refs": ["framework:cn-chem-junior:expectation:d1df953d3e"],
  "profile_refs": ["profile:method-gas-collection-water-displacement-junior-chem"],
  "source_refs": ["evidence:chem-grade8-all-in-one:lesson:2-1-3:gas-collection-methods"],
  "properties": {},
  "status": "reviewed",
  "updated_at": "2026-03-25T18:00:00+08:00"
}
