{
  "id": "node-card:concept__compound",
  "node_id": "concept:compound",
  "card_layer": "backbone",
  "title": "化合物",
  "pattern_refs": ["pattern:concept-core-v2"],
  "summary": "化合物是由两种或两种以上元素组成的纯净物，是纯净物的一个重要类别。化合物的组成元素固定，具有确定的化学式。",
  "sections": [
    {
      "id": "definition",
      "title": "定义",
      "section_type": "definition",
      "content": [
        "化合物是由两种或两种以上元素组成的纯净物。",
        "例如：二氧化碳(CO₂)、酒精(C₂H₅OH)、氯化钾(KCl)、水(H₂O)等都是化合物。",
        "化合物是纯净物的一种，其组成元素固定。"
      ],
      "source_refs": ["evidence:chem-grade8-all-in-one:lesson:3-2-2:simple-substance-compound"]
    },
    {
      "id": "essence",
      "title": "本质理解",
      "section_type": "essence",
      "content": [
        "化合物是物质分类中的一个重要概念，反映了物质的元素组成特征。",
        "化合物强调的是元素种类的多样性，即含有两种或两种以上元素。",
        "化合物与混合物的区别：化合物是纯净物，组成元素固定；混合物不是纯净物，各成分保持各自性质。",
        "化合物与单质的区别：化合物含有多种元素，单质只含有一种元素。"
      ],
      "source_refs": ["evidence:chem-grade8-all-in-one:lesson:3-2-2:simple-substance-compound"]
    },
    {
      "id": "key-points",
      "title": "核心要点",
      "section_type": "key_points",
      "content": [
        "化合物必须同时满足两个条件：(1)是纯净物；(2)含有两种或两种以上元素。",
        "化合物的组成元素固定，有确定的化学式。",
        "化合物中各元素以一定比例结合，不能用物理方法分离。",
        "氧化物是化合物的一个子类，特指由两种元素组成且其中一种是氧元素的化合物。"
      ],
      "source_refs": ["evidence:chem-grade8-all-in-one:lesson:3-2-2:simple-substance-compound"]
    },
    {
      "id": "examples",
      "title": "典型例子",
      "section_type": "example",
      "content": [
        "二氧化碳(CO₂)：由碳元素和氧元素组成的化合物。",
        "酒精(C₂H₅OH)：由碳、氢、氧三种元素组成的化合物。",
        "氯化钾(KCl)：由钾元素和氯元素组成的化合物。",
        "水(H₂O)：由氢元素和氧元素组成的化合物。",
        "过氧化氢(H₂O₂)：由氢元素和氧元素组成的化合物。"
      ],
      "source_refs": ["evidence:chem-grade8-all-in-one:lesson:3-2-2:simple-substance-compound"]
    },
    {
      "id": "misconceptions",
      "title": "易混辨析",
      "section_type": "misconception",
      "content": [
        "混合物不是化合物：空气是混合物，不是化合物，各成分保持各自性质。",
        "化合物元素种类固定：化合物中各元素以固定比例结合，不同于混合物。",
        "同种元素组成不同物质：水和过氧化氢都由氢、氧元素组成，但性质不同。"
      ]
    }
  ],
  "framework_refs": ["framework:cn-chem-junior:expectation:68980548de"],
  "profile_refs": ["profile:concept-compound-junior-chem"],
  "source_refs": ["evidence:chem-grade8-all-in-one:lesson:3-2-2:simple-substance-compound"],
  "properties": {},
  "status": "reviewed",
  "updated_at": "2026-03-26T00:00:00+08:00"
}
