{
  "id": "node-card:activity-experiment-water-calcium-oxide-reaction",
  "node_id": "activity/experiment:water-calcium-oxide-reaction",
  "card_layer": "support",
  "title": "水与氧化钙反应实验",
  "pattern_refs": ["pattern:activity-task-v2"],
  "summary": "通过将水滴入氧化钙中观察反应现象，验证水与氧化钙发生剧烈反应放出大量热并生成氢氧化钙的实验。",
  "sections": [
    {
      "id": "activity-goal",
      "title": "活动目标",
      "section_type": "definition",
      "content": [
        "观察水与氧化钙反应的现象",
        "验证水与氧化钙反应放出大量热",
        "检验生成物氢氧化钙的碱性"
      ],
      "source_refs": ["evidence:chem-grade8-all-in-one:lesson:3-1-1:water-calcium-oxide-reaction"]
    },
    {
      "id": "setup",
      "title": "材料与条件",
      "section_type": "structure",
      "content": [
        "材料：氧化钙（少量）、水、酚酞试液",
        "仪器：烧杯、滴管",
        "安全提示：氧化钙具有较强腐蚀性，需注意防护"
      ],
      "source_refs": ["evidence:chem-grade8-all-in-one:lesson:3-1-1:calcium-oxide-definition"],
      "related_node_refs": ["entity/substance:calcium-oxide", "entity/substance:water"]
    },
    {
      "id": "procedure",
      "title": "实施过程",
      "section_type": "procedure",
      "content": [
        "在烧杯中加入少量氧化钙",
        "用滴管向烧杯中加入约1滴管水",
        "用手小心触摸烧杯外壁，感受温度变化",
        "待反应停止、冷却后，向烧杯中滴入3滴酚酞试液",
        "观察并记录实验现象"
      ],
      "source_refs": ["evidence:chem-grade8-all-in-one:lesson:3-1-1:water-calcium-oxide-reaction"]
    },
    {
      "id": "observations",
      "title": "关键观察",
      "section_type": "evidence",
      "content": [
        "现象1：水与氧化钙接触后剧烈反应",
        "现象2：烧杯外壁发烫，说明反应放出大量热",
        "现象3：滴入酚酞试液后溶液变红，说明生成了碱性物质（氢氧化钙）",
        "结论：水与氧化钙反应生成氢氧化钙，该反应是放热的化学反应"
      ],
      "source_refs": ["evidence:chem-grade8-all-in-one:lesson:3-1-1:water-calcium-oxide-reaction"],
      "related_node_refs": ["entity/substance:calcium-hydroxide"]
    },
    {
      "id": "reflection",
      "title": "反思与拓展",
      "section_type": "reflection",
      "content": [
        "哪些现象说明水与氧化钙发生了反应？",
        "如何通过间接方法判断化学反应的发生？",
        "例题：水滴入装有氧化钙的试管中，U形管红墨水液面左边低右边高，说明反应放热使空气膨胀"
      ],
      "source_refs": ["evidence:chem-grade8-all-in-one:lesson:3-1-1:water-calcium-oxide-reaction"]
    }
  ],
  "profile_refs": ["profile:activity-experiment-water-calcium-oxide-reaction-junior-chem"],
  "source_refs": [
    "evidence:chem-grade8-all-in-one:lesson:3-1-1:water-calcium-oxide-reaction",
    "evidence:chem-grade8-all-in-one:lesson:3-1-1:calcium-oxide-definition"
  ],
  "properties": {},
  "status": "reviewed",
  "updated_at": "2026-03-25T20:00:00+08:00"
}
