{
  "id": "node-card:method-gas-collection-upward-air",
  "node_id": "method:gas-collection-upward-air",
  "card_layer": "support",
  "title": "向上排空气法",
  "pattern_refs": ["pattern:method-procedure-v2"],
  "summary": "向上排空气法是收集密度比空气大的气体的方法，适用于不与空气反应且密度明显大于空气的气体，如二氧化碳、氧气等。",
  "sections": [
    {
      "id": "goal",
      "title": "目标",
      "section_type": "definition",
      "content": [
        "收集密度比空气大的气体。",
        "获得相对干燥的气体样品。",
        "操作简便，适用于溶于水的气体。"
      ],
      "source_refs": ["evidence:chem-grade8-all-in-one:lesson:2-1-3:gas-collection-methods"]
    },
    {
      "id": "conditions",
      "title": "适用条件",
      "section_type": "assessment",
      "content": [
        "气体密度比空气大（相对分子质量大于29）。",
        "气体不与空气中的成分反应。",
        "适用气体：二氧化碳（密度44>29）、氧气（密度32>29）。",
        "不适用气体：氢气（密度2<29）、氨气（密度17<29）。"
      ],
      "source_refs": ["evidence:chem-grade8-all-in-one:lesson:2-1-3:gas-collection-methods"]
    },
    {
      "id": "steps",
      "title": "操作步骤",
      "section_type": "procedure",
      "content": [
        "第一步：准备集气瓶——将干燥的集气瓶正放在桌面上。",
        "第二步：插入导管——将气体导管伸到集气瓶底部（瓶口朝上）。",
        "第三步：收集气体——气体从底部向上充满集气瓶，空气从瓶口排出。",
        "第四步：检验是否收集满——用特定方法检验气体是否收集满。",
        "二氧化碳检验：用燃着的木条放在瓶口，熄灭则满。",
        "氧气检验：用带火星的木条放在瓶口，复燃则满。"
      ],
      "source_refs": ["evidence:chem-grade8-all-in-one:lesson:2-1-3:gas-collection-methods", "evidence:chem-grade8-all-in-one:lesson:2-1-3:co2-lab-preparation"]
    },
    {
      "id": "errors",
      "title": "注意事项",
      "section_type": "misconception",
      "content": [
        "导管必须伸到集气瓶底部，便于空气排出。",
        "集气瓶口朝上放置（瓶口向上）。",
        "优点：气体干燥，适用于溶于水的气体。",
        "缺点：气体纯度较低，难以判断是否收集满。"
      ],
      "source_refs": ["evidence:chem-grade8-all-in-one:lesson:2-1-3:gas-collection-methods"]
    }
  ],
  "framework_refs": ["framework:cn-chem-junior:expectation:d1df953d3e"],
  "profile_refs": ["profile:method-gas-collection-upward-air-junior-chem"],
  "source_refs": ["evidence:chem-grade8-all-in-one:lesson:2-1-3:gas-collection-methods", "evidence:chem-grade8-all-in-one:lesson:2-1-3:co2-lab-preparation"],
  "properties": {},
  "status": "reviewed",
  "updated_at": "2026-03-25T18:00:00+08:00"
}
