{
  "id": "node-card:concept-catalyst",
  "node_id": "concept:catalyst",
  "card_layer": "backbone",
  "title": "催化剂",
  "pattern_refs": ["pattern:concept-core-v2"],
  "summary": "催化剂是一种能够改变化学反应速率，但在反应前后本身的质量和化学性质都不发生变化的物质。催化剂在化学实验和工业生产中有广泛应用，如二氧化锰催化过氧化氢分解制取氧气。",
  "sections": [
    {
      "id": "definition",
      "title": "定义",
      "section_type": "definition",
      "content": [
        "在化学反应中，能够改变化学反应的速率而本身的质量和化学性质在反应前后均不发生变化的物质叫做催化剂。",
        "催化剂的特点是：一变（改变反应速率）、两不变（质量和化学性质不变）。",
        "催化剂在反应结束后仍然存在，可以重复使用。"
      ],
      "source_refs": ["evidence:chem-grade8-all-in-one:lesson:2-1-3:catalyst-definition"]
    },
    {
      "id": "essence",
      "title": "本质理解",
      "section_type": "essence",
      "content": [
        "催化剂通过降低反应所需的活化能来加快反应速率，但不参与最终产物的生成。",
        "催化剂只能加快或减慢反应速率，不能使原来不能发生的反应发生。",
        "催化剂对反应速率的影响程度与催化剂的用量有关，但催化剂本身在反应中不被消耗。"
      ],
      "source_refs": ["evidence:chem-grade8-all-in-one:lesson:2-1-3:catalyst-definition"]
    },
    {
      "id": "key-points",
      "title": "核心要点",
      "section_type": "key_points",
      "content": [
        "催化剂的特点：改变反应速率；质量和化学性质在反应前后不变。",
        "二氧化锰是过氧化氢分解和氯酸钾分解的常用催化剂。",
        "催化剂具有选择性：一种催化剂只能催化特定的反应。",
        "催化剂不能改变生成物的种类和产量。"
      ],
      "source_refs": ["evidence:chem-grade8-all-in-one:lesson:2-1-3:catalyst-definition", "evidence:chem-grade8-all-in-one:lesson:2-1-3:potassium-chlorate-decomposition"]
    },
    {
      "id": "examples",
      "title": "典型例子",
      "section_type": "example",
      "content": [
        "二氧化锰催化过氧化氢分解：过氧化氢在二氧化锰催化下快速分解生成水和氧气。",
        "二氧化锰催化氯酸钾分解：氯酸钾在二氧化锰催化下加热分解生成氯化钾和氧气。",
        "工业上用铁触媒催化氨的合成。",
        "生物体内的酶是生物催化剂，催化生物体内的各种化学反应。"
      ],
      "source_refs": ["evidence:chem-grade8-all-in-one:lesson:2-1-3:potassium-chlorate-decomposition"]
    },
    {
      "id": "misconceptions",
      "title": "易混辨析",
      "section_type": "misconception",
      "content": [
        "误区：认为催化剂只能加快反应速率。纠正：催化剂也可以减慢反应速率（称为抑制剂或负催化剂）。",
        "误区：认为催化剂不参与反应。纠正：催化剂参与反应过程，但反应结束时恢复原状。",
        "误区：认为催化剂能增加产物。纠正：催化剂只能改变反应速率，不能改变生成物的种类和量。"
      ],
      "source_refs": ["evidence:chem-grade8-all-in-one:lesson:2-1-3:catalyst-definition"]
    }
  ],
  "framework_refs": ["framework:cn-chem-junior:expectation:ff518734a1"],
  "profile_refs": ["profile:concept-catalyst-junior-chem"],
  "source_refs": [
    "evidence:chem-grade8-all-in-one:lesson:2-1-3:catalyst-definition",
    "evidence:chem-grade8-all-in-one:lesson:2-1-3:potassium-chlorate-decomposition"
  ],
  "properties": {},
  "status": "reviewed",
  "updated_at": "2026-03-25T18:00:00+08:00"
}
