{
  "id": "node-card:activity-experiment-co2-lab-preparation",
  "node_id": "activity/experiment:co2-lab-preparation",
  "card_layer": "support",
  "title": "实验室制取二氧化碳实验",
  "pattern_refs": ["pattern:activity-task-v2"],
  "summary": "实验室制取二氧化碳是初中化学必做实验之一，采用石灰石或大理石与稀盐酸反应，通过向上排空气法收集二氧化碳气体。该实验体现了实验室制取气体的一般思路与方法。",
  "sections": [
    {
      "id": "activity-goal",
      "title": "活动目标",
      "section_type": "definition",
      "content": [
        "掌握实验室制取二氧化碳的原理和方法。",
        "学会用向上排空气法收集和检验二氧化碳。",
        "理解反应物的选择原则（为什么用稀盐酸而不用稀硫酸）。",
        "培养规范的实验操作技能和科学探究能力。"
      ],
      "source_refs": ["evidence:chem-grade8-all-in-one:lesson:2-1-3:co2-lab-preparation"]
    },
    {
      "id": "setup",
      "title": "材料与条件",
      "section_type": "structure",
      "content": [
        "反应物：石灰石或大理石（主要成分碳酸钙）、稀盐酸。",
        "仪器：锥形瓶、长颈漏斗、导管、集气瓶、玻璃片、橡皮塞。",
        "收集方法：向上排空气法（因为二氧化碳密度比空气大，且溶于水）。",
        "反应条件：常温下进行，不需要加热。"
      ],
      "source_refs": ["evidence:chem-grade8-all-in-one:lesson:2-1-3:co2-lab-preparation"]
    },
    {
      "id": "procedure",
      "title": "实施过程",
      "section_type": "procedure",
      "content": [
        "实验室制取二氧化碳步骤：",
        "(1) 连接装置，检查气密性。",
        "(2) 向锥形瓶中小心地放入几小块石灰石或大理石。",
        "(3) 从长颈漏斗口往锥形瓶中加入稀盐酸，直至液体浸没长颈漏斗的下端管口。",
        "(4) 用向上排空气法收集二氧化碳气体。",
        "(5) 用燃着的火柴或木条放在集气瓶口检验是否收集满（熄灭则满）。",
        "(6) 集满后，将导管从集气瓶内移出，用毛玻璃片盖好集气瓶。"
      ],
      "source_refs": ["evidence:chem-grade8-all-in-one:lesson:2-1-3:co2-lab-preparation"]
    },
    {
      "id": "observations",
      "title": "关键观察",
      "section_type": "evidence",
      "content": [
        "石灰石与稀盐酸接触后产生大量气泡，说明产生了气体。",
        "用燃着的木条放在集气瓶口，木条熄灭，证明收集的是二氧化碳。",
        "反应后的液体为氯化钙溶液。",
        "化学方程式：CaCO3 + 2HCl → CaCl2 + H2O + CO2↑"
      ],
      "source_refs": ["evidence:chem-grade8-all-in-one:lesson:2-1-3:co2-lab-preparation"]
    },
    {
      "id": "notes",
      "title": "注意事项",
      "section_type": "key_points",
      "content": [
        "不能用稀硫酸代替稀盐酸：硫酸与碳酸钙反应生成微溶的硫酸钙，覆盖在石灰石表面，阻止反应继续进行。",
        "长颈漏斗下端必须浸没在液面以下，防止气体从漏斗逸出。",
        "不能用碳酸钠代替石灰石：碳酸钠与盐酸反应太快，不便于收集。",
        "不能用浓盐酸：浓盐酸挥发出氯化氢气体，使收集的二氧化碳不纯。"
      ],
      "source_refs": ["evidence:chem-grade8-all-in-one:lesson:2-1-3:co2-lab-preparation"]
    }
  ],
  "framework_refs": ["framework:cn-chem-junior:expectation:905f989c42", "framework:cn-chem-junior:expectation:d1df953d3e"],
  "profile_refs": ["profile:activity-experiment-co2-lab-preparation-junior-chem"],
  "source_refs": [
    "evidence:chem-grade8-all-in-one:lesson:2-1-3:co2-lab-preparation",
    "evidence:chem-grade8-all-in-one:lesson:2-1-3:gas-preparation-method"
  ],
  "properties": {
    "student_required_experiment": true
  },
  "status": "reviewed",
  "updated_at": "2026-03-25T18:00:00+08:00"
}
