{
  "id": "node-card:entity-particle-water-molecule",
  "node_id": "entity/particle:water-molecule",
  "card_layer": "backbone",
  "title": "水分子",
  "pattern_refs": ["pattern:entity-profile-v2"],
  "summary": "水分子是构成水的微观粒子，每个水分子由两个氢原子和一个氧原子构成，化学式为H2O。大量水分子聚集形成水。",
  "sections": [
    {
      "id": "identity",
      "title": "基本身份",
      "section_type": "definition",
      "content": [
        "水分子是构成水的微观粒子。",
        "每个水分子由两个氢原子和一个氧原子构成。",
        "水的化学式为H2O，表示一个水分子中含有2个氢原子和1个氧原子。"
      ],
      "source_refs": ["evidence:chem-grade8-all-in-one:lesson:3-1-3:water-molecule-structure"]
    },
    {
      "id": "properties",
      "title": "关键属性",
      "section_type": "structure",
      "content": [
        "化学式：H2O",
        "组成：2个氢原子 + 1个氧原子",
        "尺度：微观粒子，肉眼不可见",
        "大量水分子聚集形成宏观的水"
      ],
      "source_refs": ["evidence:chem-grade8-all-in-one:lesson:3-1-3:water-molecule-structure"]
    },
    {
      "id": "behavior",
      "title": "在化学变化中的行为",
      "section_type": "procedure",
      "content": [
        "在电解水时，水分子分解为氢原子和氧原子。",
        "每两个氢原子结合成一个氢分子。",
        "每两个氧原子结合成一个氧分子。"
      ],
      "source_refs": ["evidence:chem-grade8-all-in-one:lesson:3-1-3:water-molecule-structure"]
    },
    {
      "id": "related-molecules",
      "title": "关联分子",
      "section_type": "comparison",
      "content": [
        "氢分子（H2）：由2个氢原子构成，构成氢气",
        "氧分子（O2）：由2个氧原子构成，构成氧气",
        "水分子、氢分子、氧分子都是双原子分子（其中水分子含两种原子）"
      ],
      "related_node_refs": ["entity/particle:hydrogen-molecule", "entity/particle:oxygen-molecule"],
      "source_refs": ["evidence:chem-grade8-all-in-one:lesson:3-1-3:water-molecule-structure"]
    }
  ],
  "framework_refs": ["framework:cn-chem-junior:expectation:0faf4e20e5"],
  "profile_refs": ["profile:entity-particle-water-molecule-junior-chem"],
  "source_refs": ["evidence:chem-grade8-all-in-one:lesson:3-1-3:water-molecule-structure"],
  "properties": {},
  "status": "reviewed",
  "updated_at": "2026-03-25T23:00:00+08:00"
}
